ParticipantID,Condition,Handedness,TrialID,PhraseID,TargetPhrase,InputPhrase,TargetCharCount,InputCharCount,DurationSec,ActiveDurationSec,LevenshteinDist,TotalKeystrokes,WPM,ActiveWPM,MeanWordWPM,CER,KSPC,BackspaceCount
debug-MK08,Proposed,L,1,479,most judges are very honest,most judge m judges are fern very nonese honest,27,47,252.541,221.35899999999998,20,202,2.185783694528809,2.493686726087487,3.003376040833467,0.7407407407407407,4.297872340425532,71
debug-MK08,Proposed,L,2,382,microscopes make small things look big,microscopes make small things look big,38,38,125.309,112.08099999999999,0,59,3.543241107981071,3.9614207582016583,4.719310481678545,0.0,1.5526315789473684,8
debug-MK08,Proposed,L,3,457,learn to walk before you run,c learn learn to walk before muthu run you run,28,46,80.912,62.628,18,54,6.673917342297805,8.62234144472121,6.724532049128568,0.6428571428571429,1.173913043478261,4
debug-MK08,Proposed,L,4,371,we dine out on the weekends,we dine out on the weekends,27,27,65.805,52.428999999999995,0,42,4.741281057670389,5.950905033473842,4.132643708525497,0.0,1.5555555555555556,3
debug-MK08,Proposed,L,5,379,bring the offenders to justice,bring the offence offenders to justice,30,38,85.276,73.82000000000001,8,45,5.206623199962475,6.014630181522622,4.874795866148145,0.26666666666666666,1.1842105263157894,3
