ParticipantID,Condition,Handedness,TrialID,PhraseID,TargetPhrase,InputPhrase,TargetCharCount,InputCharCount,DurationSec,LevenshteinDist,TotalKeystrokes,WPM,CER,KSPC,BackspaceCount
debug-MT04,Proposed,R,1,22,great disturbance in the force,g m great disturbance in the force,30,34,104.482539,4,83,3.790106976630803,0.13333333333333333,2.4411764705882355,25
debug-MT04,Proposed,R,2,176,I listen to the tape everyday,i listen to the tape every everyday,29,35,75.966617,6,53,5.3707801678202935,0.20689655172413793,1.5142857142857142,9
debug-MT04,Proposed,R,3,461,pumping helps if the roads are slippery,pumping helps if the roads are slippery,39,39,59.051159,0,54,7.722117697977782,0.0,1.3846153846153846,7
debug-MT04,Proposed,R,4,334,that is a very odd question,that is a very odd question very odd question,27,45,84.999182,18,98,6.211824485557991,0.6666666666666666,2.1777777777777776,19
debug-MT04,Proposed,R,5,390,we have enough witnesses,we have a enough si witnesses,24,29,30.563679,5,44,10.993440940143362,0.20833333333333334,1.5172413793103448,6
