ParticipantID,Condition,Handedness,TrialID,PhraseID,TargetPhrase,InputPhrase,TargetCharCount,InputCharCount,DurationSec,LevenshteinDist,TotalKeystrokes,WPM,CER,KSPC,BackspaceCount
debug-MT04,Controller,R,1,431,so you think you deserve a raise,so you think you deserve a raise,32,32,67.630082,0,79,5.500510852552271,0.0,2.46875,8
debug-MT04,Controller,R,2,165,peek out the window,peak peek out the window,19,24,30.506223,5,32,9.047334375022434,0.2631578947368421,1.3333333333333333,4
debug-MT04,Controller,R,3,208,my fingers are very cold,my fingers are very cold,24,24,26.447495,0,39,10.435770949195755,0.0,1.625,2
debug-MT04,Controller,R,4,130,sent this by registered mail,sent this by registered mail,28,28,20.884238,0,29,15.51409249406179,0.0,1.0357142857142858,0
debug-MT04,Controller,R,5,39,are you talking to me,are you talking to me,21,21,32.469778,0,28,7.391488786895926,0.0,1.3333333333333333,1
