ParticipantID,Condition,Handedness,TrialID,PhraseID,TargetPhrase,InputPhrase,TargetCharCount,InputCharCount,DurationSec,LevenshteinDist,TotalKeystrokes,WPM,CER,KSPC,BackspaceCount
debug-MT10,Keyboard,R,1,148,make my day you sucker,make my day you sucker,22,22,7.702737,0,51,32.71564380297549,0.0,2.3181818181818183,0
debug-MT10,Keyboard,R,2,145,stay away from strangers,stay away from strangers,24,24,11.621363,0,41,23.749365715536115,0.0,1.7083333333333333,6
debug-MT10,Keyboard,R,3,209,rain rain go away,rain rain go away,17,17,4.302557,0,24,44.62462670453872,0.0,1.411764705882353,0
debug-MT10,Keyboard,R,4,262,valid until the end of the year,valid until the end of the near year,31,36,14.821347,5,50,28.337505356294542,0.16129032258064516,1.3888888888888888,3
debug-MT10,Keyboard,R,5,447,nothing wrong with his style,nothing wrong with huis his style,28,33,8.49094,5,41,45.22467477099119,0.17857142857142858,1.2424242424242424,3
