ParticipantID,Condition,Handedness,TrialID,PhraseID,TargetPhrase,InputPhrase,TargetCharCount,InputCharCount,DurationSec,LevenshteinDist,TotalKeystrokes,WPM,CER,KSPC,BackspaceCount
debug-EM09,Keyboard,R,1,160,can we play cards tonight,can we play cards tonight,25,25,11.955411,0,36,24.089510599008264,0.0,1.44,0
debug-EM09,Keyboard,R,2,2,never too rich and never too thin,never too rich and never too thin,33,33,19.346429,0,64,19.84862426032215,0.0,1.9393939393939394,0
debug-EM09,Keyboard,R,3,242,the fourth edition was better,the fourth edition was better,29,29,16.41939,0,32,20.46361040209167,0.0,1.103448275862069,1
debug-EM09,Keyboard,R,4,99,what a monkey sees a monkey will do,what a monkey sees a monkey will do,35,35,16.855747,0,38,24.205394160223214,0.0,1.0857142857142856,0
debug-EM09,Keyboard,R,5,118,healthy food is good for you,healthy food is good for you,28,28,11.56654,0,49,28.01183413535941,0.0,1.75,4
