ParticipantID,Condition,Handedness,TrialID,PhraseID,TargetPhrase,InputPhrase,TargetCharCount,InputCharCount,DurationSec,ActiveDurationSec,LevenshteinDist,TotalKeystrokes,WPM,ActiveWPM,MeanWordWPM,CER,KSPC,BackspaceCount
debug-CS10,Keyboard,R,1,89,round robin scheduling,bony round robin scheduling,22,27,16.493,14.745,5,30,18.917116352391925,21.15971515768057,18.713901663881103,0.22727272727272727,1.1111111111111112,1
debug-CS10,Keyboard,R,2,137,a duck quacks to ask for food,a duck quacks to ask for food,29,29,16.267,11.767999999999999,0,36,20.655314440277863,28.552005438477227,18.871999862578303,0.0,1.2413793103448276,0
debug-CS10,Keyboard,R,3,183,these cookies are so amazing,these cookies are so amazing,28,28,22.932,13.002,0,33,14.128728414442701,24.91924319335487,26.87752241896692,0.0,1.1785714285714286,2
debug-CS10,Keyboard,R,4,119,hands on experience with a job,hands on experiment experience with a job,30,41,26.086,20.645,11,63,18.400674691405353,23.250181642044076,19.2045694947291,0.36666666666666664,1.5365853658536586,6
debug-CS10,Keyboard,R,5,125,I do not fully agree with you,i do not fully agree with you,29,29,15.255,11.613000000000001,0,36,22.025565388397244,28.93309222423146,19.364015450071104,0.0,1.2413793103448276,2
