ParticipantID,Condition,Handedness,TrialID,PhraseID,TargetPhrase,InputPhrase,TargetCharCount,InputCharCount,DurationSec,LevenshteinDist,TotalKeystrokes,WPM,CER,KSPC,BackspaceCount
debug-KM02,Keyboard,R,1,51,take a coffee break,take a coffee break,19,19,19.160297,0,78,11.273311681964012,0.0,4.105263157894737,6
debug-KM02,Keyboard,R,2,285,stability of the nation,stabilioty stability stability of the nation,23,44,50.558659,21,81,10.205966894810244,0.9130434782608695,1.8409090909090908,7
debug-KM02,Keyboard,R,3,383,a coupon for a free sample,a coupon for a free sample,26,26,16.355922,0,37,18.341980354271683,0.0,1.4230769230769231,4
debug-KM02,Keyboard,R,4,111,world population is growing,world population is growing,27,27,15.142477,0,40,20.604290830357545,0.0,1.4814814814814814,6
debug-KM02,Keyboard,R,5,433,good jobs for those with education,good jobs for those with education,34,34,28.509077,0,113,13.890312899291688,0.0,3.323529411764706,22
