ParticipantID,Condition,Handedness,TrialID,PhraseID,TargetPhrase,InputPhrase,TargetCharCount,InputCharCount,DurationSec,LevenshteinDist,TotalKeystrokes,WPM,CER,KSPC,BackspaceCount
debug-KM02,Proposed,R,1,354,her majesty visited our country,her man majesty visited our con country,31,39,96.242578,8,65,4.7380276949771645,0.25806451612903225,1.6666666666666667,2
debug-KM02,Proposed,R,2,210,bad for the environment,bad for the c environment,23,25,29.066169,2,42,9.908426528449622,0.08695652173913043,1.68,7
debug-KM02,Proposed,R,3,484,dormitory doors are locked at midnight,dormitory roles m dormitory doors are locked at midnight,38,56,64.212182,18,155,10.27842349291292,0.47368421052631576,2.767857142857143,66
debug-KM02,Proposed,R,4,488,questioning the wisdom of the courts,questioning the wisdom or or or of the courts,36,45,52.022538,9,100,10.149447149233666,0.25,2.2222222222222223,17
debug-KM02,Proposed,R,5,18,please provide your date of birth,please provide your date of birth,33,33,49.21752,0,58,7.802099740092553,0.0,1.7575757575757576,4
