ParticipantID,Condition,Handedness,TrialID,PhraseID,TargetPhrase,InputPhrase,TargetCharCount,InputCharCount,DurationSec,LevenshteinDist,TotalKeystrokes,WPM,CER,KSPC,BackspaceCount
debug-KM02,Controller,R,1,91,my favorite web browser,my favorite web browser,23,23,33.778433,0,59,7.8156378657352175,0.0,2.5652173913043477,3
debug-KM02,Controller,R,2,71,there will be some fog tonight,there are will be some fog tonight,30,34,50.989652,4,64,7.7662816761330316,0.13333333333333333,1.8823529411764706,6
debug-KM02,Controller,R,3,304,medieval times were very hard,medial medical medieval times were very hard,29,44,52.712915,15,65,9.788872423389979,0.5172413793103449,1.4772727272727273,7
debug-KM02,Controller,R,4,195,do a good deed to someone,do a good deed to someone,25,25,23.81914,0,34,12.091116639811512,0.0,1.36,2
debug-KM02,Controller,R,5,264,tickets are very expensive,tickets are very expensive,26,26,20.226809,0,33,14.831800705687192,0.0,1.2692307692307692,1
