ParticipantID,Condition,Handedness,TrialID,PhraseID,TargetPhrase,InputPhrase,TargetCharCount,InputCharCount,DurationSec,LevenshteinDist,TotalKeystrokes,WPM,CER,KSPC,BackspaceCount
debug-YM11,Controller,R,1,454,why do you ask silly questions,why do you silly ask silly ask silly question questions,30,55,102.654524,25,96,6.312434900579736,0.8333333333333334,1.7454545454545454,20
debug-YM11,Controller,R,2,5,physics and chemistry are hard,physics and chemistry are hard,30,30,25.906877,0,43,13.432726762087146,0.0,1.4333333333333333,4
debug-YM11,Controller,R,3,159,nobody cares anymore,nobody cares anymore,20,20,25.498083,0,31,8.941848687213072,0.0,1.55,0
debug-YM11,Controller,R,4,335,a feeling of complete exasperation,a feeling of comple complete exasperation,34,41,74.038436,7,52,6.483119119371997,0.20588235294117646,1.2682926829268293,5
debug-YM11,Controller,R,5,473,irregular verbs are the hardest to learn,irregular verbs are by hardest the hardest to learn,40,51,55.167918,11,61,10.875886235184732,0.275,1.196078431372549,5
