ParticipantID,Condition,Handedness,TrialID,PhraseID,TargetPhrase,InputPhrase,TargetCharCount,InputCharCount,DurationSec,LevenshteinDist,TotalKeystrokes,WPM,CER,KSPC,BackspaceCount
debug-YM11,Proposed,R,1,5,physics and chemistry are hard,physics and ritmo and chemistry are hard,30,40,203.012417,10,110,2.305277711165815,0.3333333333333333,2.75,13
debug-YM11,Proposed,R,2,35,play it again Sam,play it again sam,17,17,59.392266,0,80,3.2327441421413354,0.0,4.705882352941177,6
debug-YM11,Proposed,R,3,89,round robin scheduling,round borin robin scheduling,22,28,100.082098,6,83,3.2373422067950655,0.2727272727272727,2.9642857142857144,17
debug-YM11,Proposed,R,4,385,a subject one can really enjoy,a subject one can really enjoy,30,30,121.085285,0,59,2.874007357706595,0.0,1.9666666666666666,11
debug-YM11,Proposed,R,5,275,a good response to the question,a good response to the queston question,31,39,88.101106,8,69,5.175871458412791,0.25806451612903225,1.7692307692307692,3
