ParticipantID,Condition,Handedness,TrialID,PhraseID,TargetPhrase,InputPhrase,TargetCharCount,InputCharCount,DurationSec,ActiveDurationSec,LevenshteinDist,TotalKeystrokes,WPM,ActiveWPM,MeanWordWPM,CER,KSPC,BackspaceCount
debug-SS05,Proposed,R,1,422,please take a bath this month,please take a this bath this month,29,34,108.871,88.002,5,77,3.6373322556052576,4.499897729597055,3.6494403606255434,0.1724137931034483,2.264705882352941,3
debug-SS05,Proposed,R,2,37,you are not a jedi yet,you are not a jedi yet,22,22,37.289,28.840999999999998,0,43,6.75802515487141,8.737561110918485,6.316796344110006,0.0,1.9545454545454546,3
debug-SS05,Proposed,R,3,125,I do not fully agree with you,i do fully not fully agree with you,29,35,50.46,37.43,6,41,8.085612366230677,10.900347314987977,7.945845585391566,0.20689655172413793,1.1714285714285715,2
debug-SS05,Proposed,R,4,130,sent this by registered mail,sent this by registered se se sent this by registered mail,28,58,102.133,76.222,30,98,6.697149794875311,8.9737870955892,6.92765588895204,1.0714285714285714,1.6896551724137931,23
debug-SS05,Proposed,R,5,262,valid until the end of the year,valid util until the end or of the year,31,39,55.587,41.23299999999999,8,52,8.203356899994601,11.05910314553877,7.11100568428213,0.25806451612903225,1.3333333333333333,5
