ParticipantID,Condition,Handedness,TrialID,PhraseID,TargetPhrase,InputPhrase,TargetCharCount,InputCharCount,DurationSec,LevenshteinDist,TotalKeystrokes,WPM,CER,KSPC,BackspaceCount
debug-SS05,Keyboard,R,1,155,win first prize in the contest,win first prize in the context contest,30,38,12.651664,8,47,35.094197885748464,0.26666666666666666,1.236842105263158,3
debug-SS05,Keyboard,R,2,469,I cannot believe I ate the whole thing,i cannot believe i ate the whole thing,38,38,18.363385,0,59,24.17854878063059,0.0,1.5526315789473684,4
debug-SS05,Keyboard,R,3,405,the bus was very crowded,the bus was fern very crowded,24,29,8.906783,5,35,37.72405817004859,0.20833333333333334,1.206896551724138,1
debug-SS05,Keyboard,R,4,258,is there any indication of this,is there any indication of this,31,31,7.685722,0,36,46.8401016846563,0.0,1.1612903225806452,1
debug-SS05,Keyboard,R,5,98,video camera with a zoom lens,video camera with a zoom lens,29,29,5.803815,0,30,57.89295489260081,0.0,1.0344827586206897,0
